{
    "$schema": "http://json-schema.org/draft-07/schema#",
    "$id": "https://raw.githubusercontent.com/dylanebert/shallot/main/shallot.schema.json",
    "title": "Shallot project manifest",
    "description": "The committed source of truth for a shallot project's plugin enablement (shallot.json). Read identically by every boot host.",
    "type": "object",
    "additionalProperties": false,
    "properties": {
        "$schema": {
            "type": "string",
            "description": "Pointer to this schema for editor autocomplete + validation."
        },
        "kind": {
            "enum": ["recipe", "showcase"],
            "description": "Examples only: which table of the generated examples index this project belongs to. Ignored by dev, build and run."
        },
        "description": {
            "type": "string",
            "description": "One line naming the problem the project answers; the examples index prints it."
        },
        "problem": {
            "type": "string",
            "description": "Examples only: the user's problem in their own words; the examples index prints it in place of description. Ignored by dev, build and run."
        },
        "capacity": {
            "type": "integer",
            "minimum": 1,
            "description": "Fixed entity capacity for the session (a build-time invariant). Omit for the engine default (65536)."
        },
        "pixelRatio": {
            "oneOf": [
                { "type": "number", "exclusiveMinimum": 0 },
                { "const": "auto" }
            ],
            "description": "Render pixel ratio. Use a positive number or \"auto\"; omit for the engine default."
        },
        "assets": {
            "type": "array",
            "items": { "type": "string" },
            "uniqueItems": true,
            "description": "Examples only: names of assets.json entries this project loads; `bun scripts/assets.ts` links each under this project's public/ directory. Ignored by dev, build and run."
        },
        "identifier": {
            "type": "string",
            "description": "The bundle identifier for native builds (mac CFBundleIdentifier). Omit for the default com.shallot.<basename>."
        },
        "plugins": {
            "type": "object",
            "description": "Plugin enablement. An engine plugin is enabled by name with true/false; a local/external plugin is a module specifier whose default export is the Plugin.",
            "additionalProperties": {
                "oneOf": [
                    {
                        "type": "boolean",
                        "description": "An engine plugin: true enables it, false disables a default."
                    },
                    {
                        "type": "string",
                        "description": "A local/external plugin: a module specifier (relative path like \"./src/x\" or a package subpath like \"my-plugins/grid\") whose default export is the Plugin."
                    },
                    {
                        "type": "array",
                        "description": "A local/external plugin kept but toggled off — [specifier, false] (the spec survives the toggle; the Babel/PostCSS tuple form).",
                        "minItems": 2,
                        "maxItems": 2,
                        "prefixItems": [
                            { "type": "string", "description": "The module specifier (default-exporting a Plugin)." },
                            { "type": "boolean", "description": "Whether the plugin is enabled." }
                        ],
                        "items": false
                    }
                ]
            }
        }
    }
}
